<?xml version="1.0" encoding="UTF-8"?>
<!-- edited with XMLSpy v2019 (x64) (http://www.altova.com) by Marco Pelaez (Private) -->
<Document xmlns:xsi="http://www.w3.org/2001/XMLSchema-instance" xsi:noNamespaceSchemaLocation="file:///D:/Users/jirwin/Dropbox/AMSFulfillment/XML_Specs/AMS_943_XML_V001.xsd">
	<DocumentType>943</DocumentType>
	<Version>V001</Version>
	<ClientCode>WI</ClientCode>
	<DataDate>2018-01-01</DataDate>
	<DataTime>09:30:00-08:00</DataTime>
	<InboundPO>
		<InboundPOHeader>
			<PurchaseOrderNumber>TestPoNumber</PurchaseOrderNumber>
			<Location>WIT2</Location>
			<ArrivalDate>2018-02-01</ArrivalDate>
			<POType>Receipt</POType>
			<ContainerNumber>TestContainerNumber</ContainerNumber>
		</InboundPOHeader>
		<References>
			<Reference>
				<ReferenceQualifier>String</ReferenceQualifier>
				<ReferenceText>String</ReferenceText>
			</Reference>
		</References>
		<LineItems>
			<LineItem>
				<ItemNumber>6789054321</ItemNumber>
				<UPC>008976543567</UPC>
				<QTY>10</QTY>
				<QTYUOM>EA</QTYUOM>
				<LineID>01</LineID>
			</LineItem>
			<LineItem>
				<ItemNumber>6789054322</ItemNumber>
				<UPC>008976543568</UPC>
				<QTY>101</QTY>
				<QTYUOM>EA</QTYUOM>
				<LineID>01</LineID>
			</LineItem>
		</LineItems>
	</InboundPO>
</Document>
